Sujeto,Relación,Objeto
Tomé Hernández,herido en,batalla de Atacames
batalla de Atacames,día litúrgico de,Visitación de la Virgen
Beltrán de Castro,destino tras la batalla,Panamá
comunicaciones de Beltrán de Castro,fecha de envío,1 de agosto de 1594
comunicaciones de Beltrán de Castro,fecha de llegada a Lima,14 de septiembre de 1594
procesión en Lima,fecha de,viernes posterior al 14 de septiembre de 1594
corrida de toros en Lima,fecha de,sábado posterior al 14 de septiembre de 1594
Ricardo Hawkins,destino de prisión,España
Ricardo Hawkins,año de envío a España,1595
cédula real sobre Hawkins,fecha de,17 de diciembre de 1595
Pedro Balaguer de Salcedo,cargo de,correo mayor del Perú
Pedro Balaguer de Salcedo,autor de,Relación de lo que sucedió desde 17 de mayo de 1594
Antonio Ricardo,ocupación de,primer impresor del virreinato del Perú
Antonio Ricardo,editor de,Relación de lo que sucedió desde 17 de mayo de 1594
Oña,autor de,Arauco domado
Oña,año de escritura de Arauco domado,1594
Oña,lugar de escritura de Arauco domado,Lima
Arauco domado,cantos dedicados a Hawkins,XVIII
Suárez de Figueroa,autor de,Hechos de don García Hurtado de Mendoza
Lope de Vega,autor de,Dragontea
Dragontea,cantos sobre expedición de Hawkins,"II, III y IV"
Diego de Santisteban Osorio,autor de,continuación de Araucana parte V
continuación de Araucana parte V,canto sobre Hawkins,VI
Luis Antonio de Oviedo Herrera,título nobiliario,conde de la Granja
Luis Antonio de Oviedo Herrera,autor de,poema Lima
poema Lima,lugar de publicación,Madrid
poema Lima,año de publicación,1732
poema Lima,canto sobre Hawkins,X y XVII
Pedro de Peralta Barnuevo,autor de,poema Lima
Pedro de Peralta Barnuevo,lugar de publicación de su poema Lima,Lima
Pedro de Peralta Barnuevo,año de publicación de su poema Lima,1732
Pedro de Peralta Barnuevo,canto sobre Hawkins en su poema,V
Antonio de Herrera,ocupación de,cronista
Antonio de Herrera,autor de,Historia jeneral del mundo bajo el reinado de Felipe II
capítulo sobre Hawkins en Historia jeneral del mundo,ubicación en la obra,capítulo 24 del libro III
conde de Miranda,cargo de,presidente del consejo
conde de Miranda,acción respecto a Hawkins,otorgó libertad
reina Isabel,nacionalidad,inglesa
Óñez de Loyola,cargo de,Gobernador de Chile
fuerte en Valparaíso,época de construcción proyectada,primavera de 1594
ciudad de Santa Cruz,fundador,Óñez de Loyola
escuadrilla española,número de capellanes,6
escuadrilla española,número de capellanes jesuitas,2
escuadrilla española,número de capellanes mercedarios,2
escuadrilla española,número de capellanes dominicanos,2
fray Baltasar de Obando,nombre alternativo,fray Reginaldo
fray Baltasar de Obando,cargo posterior,obispo de Imperial
fray Baltasar de Obando,orden religiosa,dominicano
García Hurtado de Mendoza,cargo de,virrey del Perú
García Hurtado de Mendoza,título nobiliario,marqués de Cañete
aviso de Chile al Callao,fecha de llegada,17 de mayo de 1594
aviso de Chile al Callao,tipo de embarcación,galizabra
avistamiento de flotas en Chincha,fecha de,4 de junio de 1594
piloto Pérez Bueno,lugar de apresamiento,Valparaíso
piloto Pérez Bueno,lugar de desembarco,puerto de Huanchaco
batalla de Atacames,fecha de inicio,1 de julio de 1594
Hawkins,lugar de apresamiento de buques,Valparaíso
Crucifijo de madera,lugar de hallazgo,buque apresado en Valparaíso
Padre Calancha,autor de,Crónica moralizada de los agustinos
Crónica moralizada de los agustinos,lugar de publicación,Barcelona
Crónica moralizada de los agustinos,año de publicación,1638
Santo Cristo de Burgos,lugar de adoración,Lima
Religiosos agustinos de Lima,origen de efigie traída,España
Padres mercedarios,fecha de solicitud de permiso,8 de julio de 1594
Padres mercedarios,institución a la que solicitaron permiso,Cabildo de Santiago
Acuerdo del cabildo de Santiago,fecha de,17 de septiembre de 1594
Gobernador Óñez de Loyola,fecha de otorgamiento de poderes a Miguel de Olaverría,10 de julio de 1594
Miguel de Olaverría,cargo de,Sargento mayor
Capitán Francisco de Zúñiga,cargo de,Regidor y fiel ejecutor de la ciudad de Santiago
Fuerte Santa Cruz,ubicación,lado izquierdo del Biobío
Fuerte Santa Cruz,proximidad a,confluencia del Biobío con el Laja
Fuerte Santa Cruz,fecha de fundación como ciudad,1 de enero de 1595
Ciudad Santa Cruz de Óñez,nombre de iglesia mayor,La exaltación de la santa cruz
Información del estado de Chile,lugar de levantamiento,asiento de Santa Cruz
Información del estado de Chile,fecha de levantamiento,últimos días de diciembre de 1594
Fray Alonso de Tiano,cargo religioso,Comendador
Bernabé Salinas,cargo religioso,Vicario
Miguel de Olaverría,procedencia inmediata,Perú
Domingo de Eraso,cargo de,Secretario del gobernador Óñez de Loyola
Domingo de Eraso,ruta de viaje a España,Buenos Aires
Domingo de Eraso,año de partida de Chile,1595
Domingo de Eraso,año de llegada a la Corte española,1597
Domingo de Eraso,año de partida de España,principios de 1598
Domingo de Eraso,lugar donde se encontraba en septiembre,Panamá
Memorial de Eraso,institución destinataria,Consejo de Indias
Memorial de Eraso,lugar de conservación,Archivo de Indias
Fraile dominicano,cargo religioso previo,Provincial de su orden
Fraile dominicano,fecha de carta al Rey,26 de marzo de 1599
Fraile dominicano,lugar desde donde escribió al Rey,Santiago
Ciudad Santa Cruz de Óñez,ubicación específica,loma al oriente del estero de Millapoa o Rele
Ciudad Santa Cruz de Óñez,distancia al Biobío,cerca de una legua
Eraso,reemplazante de poder en favor de,capitán Juan López de Arauz
capitán Juan López de Arauz,lugar de residencia,Madrid
Óñez de Loyola,cargo de,Gobernador de Chile
jesuitas,orden religiosa establecida en,Chile
agustinos,orden religiosa establecida en,Chile
Compañía de Jesús,orden religiosa de,jesuitas
doña Catalina de Miranda,compañera de viaje de,esposa de Pedro de Valdivia
doña Catalina de Miranda,lugar de residencia en Chile,Santiago
san Francisco de Borja,cargo de,general de los jesuitas
Felipe II,emisor de cédula de fecha,11 de febrero de 1579
cédula de 11 de febrero de 1579,disposición sobre,paso de jesuitas a Chile
padre Juan Román,solicitante de cédulas a,Felipe III
padre Juan Román,año de obtención de cédulas,1590
padre Baltasar de Piñas,cargo de,jefe de colonia de jesuitas
padre Baltasar de Piñas,lugar de origen,Cataluña
padre Baltasar de Piñas,conocedor de,san Ignacio de Loyola
ocho jesuitas,fecha de zarpe desde el Callao,9 de febrero de 1593
ocho jesuitas,fecha de llegada a La Serena,12 de marzo de 1593
jesuitas,fecha de entrada a Santiago,12 de abril de 1593
jesuitas,primer lugar de hospedaje en Santiago,convento de los padres dominicanos
iglesia y residencia de jesuitas en Santiago,ubicación,una cuadra de la plaza principal
solares para residencia de jesuitas,propietario anterior,Rodrigo de Quiroga
fray Cristóbal de Vera,cargo de,director de religiosos agustinos
tres religiosos agustinos,fecha de salida del Callao,enero de 1595
agustinos,lugar de primer solar en Santiago,barrio de la Cañada
convento de agustinos,ubicación en Santiago,"calle principal, dos cuadras de la plaza mayor"
incendio del convento de agustinos,fecha de ocurrencia,12 de diciembre de 1595
fray Antonio de Olivares,cargo de,provincial de los franciscanos
Nicolás de Quiroga,cargo de,corregidor de Santiago
licenciado Melchor Calderón,cargo de,provisor del obispado
licenciado Melchor Calderón,cargo de,canónigo tesorero de la catedral
san Agustín,declaración como,abogado contra la langosta
cabildo eclesiástico y cabildo civil,fecha de reunión en catedral,10 de septiembre de 1596
capitán Francisco de Riberos,donante de casa a,agustinos
Curalava,lugar de muerte de,Óñez de Loyola
ciudad de San Luis,ubicación de fundación,provincia de Cuyo
fuerte en Purén,establecido por,Óñez de Loyola
Óñez de Loyola,cargo de,Gobernador de Chile
Óñez de Loyola,fundador de,fortaleza de Jesús
fortaleza de Jesús,ubicación de,ribera norte del Biobío
Juan Guirao,cargo de,corregidor de Chillán
Fray Diego de Castro,cargo de,padre presentado
Miguel de Olaverría,cargo de,sargento mayor
marqués de Cañete,cargo de,virrey del Perú
don Luis de Velasco,cargo de,virrey de Nueva España
don Luis de Velasco,cargo de,virrey del Perú
don Gabriel de Castilla,cargo de,maestre de campo
don Gabriel de Castilla,relación familiar con,virrey Luis de Velasco
Felipe II,cargo de,Rey de España
Miguel de Olaverría,llegada a Chile con,don Alonso de Sotomayor
Óñez de Loyola,fundador de,fuerte de San Salvador de Coya
fuerte de San Salvador de Coya,ubicación de,Purén
capitán Miguel de Silva,agente de,Óñez de Loyola
plaza de Arauco,tipo de entidad,plaza militar
cordillera de Nahuelbuta,tipo de entidad,cordillera
río Lumaco,tipo de entidad,río
Santa Cruz,tipo de entidad,ciudad
Chillán,tipo de entidad,distrito
Santiago,tipo de entidad,ciudad
Biobío,tipo de entidad,río
Tucapel,tipo de entidad,distrito
Angol,tipo de entidad,ciudad
la Imperial,tipo de entidad,ciudad
Lumaco de Purén,ubicación de,ciénagas
Valparaíso,tipo de entidad,ciudad
Lima,tipo de entidad,ciudad
Callao,tipo de entidad,puerto
Paita,tipo de entidad,ciudad
San Luis,tipo de entidad,ciudad
San Luis,ubicación de,provincia de Cuyo
provincia de Cuyo,tipo de entidad,provincia
reino de Chile,tipo de entidad,reino
Perú,tipo de entidad,reino
España,tipo de entidad,reino
Nueva España,tipo de entidad,virreinato
Tierra Firme,tipo de entidad,región
Real Audiencia de Lima,tipo de entidad,institución judicial
cabildo de Santiago,tipo de entidad,institución municipal
tesoro real,tipo de entidad,institución financiera
provincia peruana del órden de ermitaños de San Agustín,tipo de entidad,orden religiosa
araucanos,tipo de entidad,pueblo indígena
Invierno de 1597,característica climática,excepcionalmente lluvioso
Río Mapocho,ubicación geográfica,Santiago
Río Mapocho,evento de inundación,salió de madre e inundó las calles de la ciudad de Santiago
Martín García Óñez de Loyola,dolencia padecida,inflamación a la vista
Martín García Óñez de Loyola,amenaza de pérdida,ojo derecho
Martín García Óñez de Loyola,cargo de,Gobernador de Chile
Guarnición española en fortificación,duración de resistencia,cinco meses
Setenta soldados españoles,participantes en,salida a batir cuerpo enemigo
Españoles en fortificación,pérdida en combate,ocho hombres
Incendio en ranchos y galpones españoles,causa del evento,descuido de un muchacho
Españoles en fortificación,pérdida por incendio,muchos caballos y provisiones
Españoles en fortificación,lugar de repliegue,Angol
Capitán Miguel de Silva,defensor de,plaza de Arauco
Ciudad de San Luis,año de fundación,1596
Ciudad de San Luis,nombre completo,San Luis de Loyola
Ciudad de San Luis,región de fundación,Cuyo
Ciudad de San Luis,característica geográfica,al otro lado de los Andes
Ciudad de San Luis,razón de fundación,esperanza de beneficiar terrenos auríferos
Don Gabriel de Castilla,cargo de,maestre de campo
Don Gabriel de Castilla,fecha de llegada a Lima,23 de abril de 1597
Martín García Óñez de Loyola,autor de,carta dirigida al Rey desde Concepción con fecha 17 de enero de 1598
Pedro de Valdivia,cargo de,primer gobernador de Chile
Don Gabriel de Castilla,fecha de salida del Callao,9 de octubre
Don Gabriel de Castilla,fecha de llegada a Valparaíso,noviembre
Don Gabriel de Castilla,duración de navegación,veintidós días
Virrey del Perú,proveedor de,veinte botijas de pólvora
Virrey del Perú,proveedor de,cuatro piezas de artillería
Virrey del Perú,proveedor de,siete mosquetes
Maestre de campo Don Gabriel de Castilla,fecha de partida para el sur,últimos días de 1597
Domingo de Eraso,cargo de,secretario de Óñez de Loyola
Jesuitas,fecha de llegada a ciudades del sur,1596
Martín García Óñez de Loyola,relación familiar con,San Ignacio de Loyola fundador de la Compañía de Jesús
Martín García Óñez de Loyola,tipo de parentesco con San Ignacio de Loyola,sobrino carnal probable
Jesuitas,asignación de solar en,ciudad de Santa Cruz
Plaza de Arauco,elevación a rango de,ciudad con el nombre de San Felipe
Santiago,contribución militar,sesenta jinetes a principios de noviembre
Capitán Jerónimo de Benavides,enviado a,Lima
Capitán Jerónimo de Benavides,misión de,pedir auxilios al Virrey para continuar la guerra
Martín García Óñez de Loyola,lugar de traslado en primavera,Valdivia
Martín García Óñez de Loyola,lugares visitados para obtener tropas,Osorno y Villarrica
Martín García Óñez de Loyola,lugar de estancia desde mediados de diciembre,la Imperial
Felipe II,monarca de,España
Alonso de Sotomayor,cargo de,Gobernador de Chile
Felipe II,organizador de,expedición naval al estrecho de Magallanes
Diego Flores de Valdés,cargo de,General de flota de veintitrés navíos
Alonso de Sotomayor,lugar de origen,ciudad de Trujillo
Alonso de Sotomayor,año de muerte,1610
Alonso de Sotomayor,lugar de muerte,Madrid
Alonso de Sotomayor,cargo de,consejo de guerra de S.M.C.
Alonso de Sotomayor,cargo militar previo,capitán de lanzas españolas en Flandes
Relacion de los servicios que hizo a S.M. don Alonso de Sotomayor,autor,licenciado Caro de Torres
Relacion de los servicios que hizo a S.M. don Alonso de Sotomayor,año de publicación,1620
Relacion de los servicios que hizo a S.M. don Alonso de Sotomayor,lugar de publicación,Madrid
De Bello Belgico,autor,padre Faminio Strada
De Bello Belgico,año de publicación,1648
De Bello Belgico,lugar de publicación,Amsterdam
flota al estrecho de Magallanes,cantidad de navíos,veintitrés navíos de alto bordo
flota al estrecho de Magallanes,cantidad de hombres alistados,cinco mil hombres
Alonso de Sotomayor,lugar de residencia familiar,Trujillo
expedición de Sotomayor a Chile,fecha de zarpe desde San Lúcar de Barrameda,25 de septiembre de 1582
expedición de Sotomayor a Chile,puerto de zarpe,San Lúcar de Barrameda
expedición de Sotomayor a Chile,puerto de recalada tras tempestad,Cádiz
tempestad en expedición de Sotomayor,cantidad de naves perdidas,tres naves
expedición de Sotomayor a Chile,cantidad de naves en condiciones tras reparación,diecisiete naves
expedición de Sotomayor a Chile,fecha de partida desde Cádiz,30 de noviembre de 1582
Alonso de Sotomayor,cantidad de soldados al partir de Cádiz,quinientos veinte hombres
Luis de Sotomayor,relación familiar con Alonso de Sotomayor,hermano mayor
Luis de Sotomayor,participante en,expedición a Chile de 1582-1583
Francisco del Campo,participante en,expedición a Chile de 1582-1583
Alonso García Ramón,participante en,expedición a Chile de 1582-1583
Luis de Sotomayor,cargo militar en,campañas de Flandes
Francisco del Campo,cargo militar en,campañas de Flandes
Alonso García Ramón,cargo militar en,campañas de Flandes
expedición de Sotomayor,ubicación en enero de 1583,isla de Santa Catalina
escuadra española en isla de Santa Catalina,cantidad de naves útiles,once naves
Diego Flores de Valdés,cantidad de naves tomadas para empresa al sur,ocho embarcaciones
Alonso de Sotomayor,cantidad de naves en viaje al Río de la Plata,tres naves
Pedro Díaz,cargo de,piloto portugués
Pedro Díaz,especialidad,navegación del Río de la Plata
Alonso de Sotomayor,cantidad de naves perdidas en Río de la Plata,una nave
Alonso de Sotomayor,destino en Río de la Plata,ciudad de Buenos Aires
Francisco de Sotomayor,relación familiar con Alonso de Sotomayor,hermano
Francisco de Sotomayor,destino de viaje en 1583,España
Francisco de Sotomayor,año de regreso a España,1583
Alonso de Sotomayor,fecha de llegada a provincias de Cuyo,12 de abril de 1583
Alonso de Sotomayor,lugar de estancia invernal,ciudad de Mendoza
Alonso de Sotomayor,período de estancia en Mendoza,abril a septiembre de 1583
Alonso de Sotomayor,fecha de llegada a San Juan,12 de abril de 1583
Cabildo de San Juan,acción de recibimiento,Alonso de Sotomayor como gobernador
Alonso de Sotomayor,fecha de llegada a Mendoza,29 de abril de 1583
Cabildo de Mendoza,acción de recibimiento,Alonso de Sotomayor como gobernador
Luis de Sotomayor,ubicación de encuentro con exploradores,río Cuarto
columna expedicionaria de Luis de Sotomayor,fecha de llegada a Mendoza,15 de agosto de 1583
columna expedicionaria de Luis de Sotomayor,cantidad de hombres al llegar a Mendoza,cuatrocientos hombres
Ramiro Yáñez de Saravia,acompañante de,Alonso de Sotomayor desde España
Ramiro Yáñez de Saravia,relación familiar,hijo de gobernador Yáñez de Saravia
Ramiro Yáñez de Saravia,representante de,cabildo de Santiago
reforma gregoriana del calendario,año de operación,1582
reforma gregoriana del calendario,año de introducción en España,1582
reforma gregoriana del calendario,año de introducción en colonias americanas de la región,1584
Duque de Medina Sidonia,cargo de,capitán general de Andalucía
Capitán Hernando Vallejo,cargo de,Corregidor de Angol
Fernando Álvarez de Toledo,cargo de,Capitán
Fernando Álvarez de Toledo,autor de,Purén indómito
Capitán Andrés Valiente,cargo de,Corregidor de la ciudad de la Imperial
Pelantaro,cargo de,Caudillo de los indios de la región de Lumaco
Pelantaro,comandante de,Cuadrilla de indios en Curalava
Anganamón,comandante de,Cuadrilla de indios en Curalava
Guaquimilla,comandante de,Cuadrilla de indios en Curalava
Desastre de Curalava,fecha de,23 de diciembre de 1598
Óñez de Loyola,fecha de partida desde la Imperial,21 de diciembre de 1598
Sitio de Curalava,ubicación geográfica,Orillas del río Lumaco
Capitán Juan Guirao,cargo de,Antiguo corregidor de Angol
Hernando Rodríguez de Gallegos,cargo de,Escribano de la gobernación
Fray Juan de Tovar,orden religiosa,Franciscano
Fray Miguel Rosillo,orden religiosa,Franciscano
Fray Melchor de Arteaga,cargo de,Lego de la orden franciscana
Bartolomé Pérez,cargo de,Clérigo natural de Valdivia
Bernardo de Pereda,categoría de,Soldado español sobreviviente de Curalava
Óñez de Loyola,estado civil,Casado con Beatriz (Coya)
Beatriz (Coya),origen,India peruana de la familia de los incas
Doña Ana María Óñez de Loyola,relación familiar,Hija de Óñez de Loyola
Doña Ana María Óñez de Loyola,estado civil,Casada con don Juan Enríquez de Borja
Doña Ana María Óñez de Loyola,título nobiliario,Marquesa de Oropesa
Pedro de Viscarra,cargo de,Gobernador interino de Chile en 1599
Don Francisco de Quiñones,cargo de,Gobernador de Chile nombrado por el Virrey del Perú
Purén indómito,categoría de,Poema que refiere sucesos militares
Fernando Álvarez de Toledo,ubicación durante sucesos de Curalava,Chillán
Familia de Óñez de Loyola,lugar de residencia desde 1593,Concepción
Capitán Galleguillos,lugar de muerte,Curalava junto al Gobernador
Capitán Juan Guirao,lugar de muerte,Curalava junto al Gobernador
Lozano,autor de,Historia de la compañía de Jesus del Paraguai
Padre Alonso de Ovalle,autor de,Historia del reino de Chile
Desastre de Marigueñu,fecha de,Febrero (año no especificado en fragmento)
Ciudad de Santa Cruz,acción administrativa,Despoblada por los españoles
Juan Donaire,ocupación,soldado
capitán Vallejo,cargo,corregidor de Angol
Pedro de Viscarra,cargo,licenciado y gobernador interino de Chile
Pedro de Viscarra,título académico,licenciado en leyes
Pedro de Viscarra,lugar de residencia inicial en América,Nicaragua
Juan Gaitán,condición,aventurero desterrado de Nicaragua
Juan Caballón,cargo,licenciado con mando superior de la provincia de Nicaragua
Pedro de Viscarra,participante en,batalla contra los facciosos de Juan Gaitán en Nicaragua
Pedro de Viscarra,cargo en Guatemala,relator de la Real Audiencia
Pedro de Viscarra,cargo en Lima,relator del tribunal
Francisco de Toledo,cargo,virrey del Perú
Pedro de Viscarra,cargo en Chile (1590),teniente gobernador y justicia mayor del reino de Chile
Óñez de Loyola,cargo,gobernador de Chile
Alonso Cid Maldonado,cargo,capitán
Luis Jufré,cargo,capitán emisario a Lima
Gaspar de la Barrera,cargo,capitán y corregidor con mando militar de Santiago
Francisco Pastene,cargo,licenciado y teniente de gobernador
Pedro de Viscarra,fecha de partida a Concepción,12 de enero de 1599
batalla de Curalava,resultado para españoles,desastre
Miguel de Silva,cargo,capitán y jefe de San Felipe de Arauco
ataque a Arauco,fecha,16 de enero de 1599
Gregorio Serrano,cargo,capitán enviado por Viscarra
Chillán,capacidad militar,"40 hombres, 2 cañones, 22 arcabuces"
Concepción,capacidad militar,"80 hombres, 5 cañones, 72 armas de fuego"
Angol,capacidad militar,"109 hombres, 2 cañones, 82 armas de fuego, 20 lanzas"
Hernando Vallejo,cargo,capitán comandante de Angol
Santa Cruz,capacidad militar,"100 hombres, 80 con armas de fuego"
Arauco,capacidad militar,"90 soldados, 13 cañones pequeños, 70 arcabuces"
Pedro de Viscarra,fecha de llegada a Concepción,22 de enero de 1599
refuerzos del Perú,contenido,"cien botijas de pólvora, cincuenta quintales de plomo, ropa y otros artículos"
Jerónimo de Benavides,rol,capitán que gestionó socorros del Perú
Pelantaro,rol,caudillo araucano
Pelantaro,número de guerreros bajo mando,mil doscientos guerreros araucanos
Francisco Jufré,cargo bajo Óñez de Loyola,general retirado en estancia cerca de Chillán
Francisco Jufré,cargo en Santa Cruz,director de la defensa de la ciudad
salida de Santa Cruz contra indios,fecha,febrero de 1599
salida de Santa Cruz,composición de fuerzas,cincuenta españoles y unos doscientos indios auxiliares
salida de Santa Cruz,resultado,pérdida de dos muertos y algunos heridos
ataque indígena a Arauco,duración de presencia indígena,doce días
Luis de Urbaneja,cargo,capitán
Álvarez de Toledo,autor de,Purén indómito
Purén indómito,obra citada sobre combate,canto VII
fortín de Longotoro,fecha de ataque,enero de 1599
fortín de Longotoro,resultado de ataque,muerte del jefe de guarnición y un soldado
Diego Barros Arana,obra citada,historia de Chile
Crescente Errázuriz,autor de,Seis años de la historia de Chile (1598-1603)
Capitán Urbaneja,fecha de muerte,11 de febrero de 1599
Combate de las serranías de Carampangue,fecha de ocurrencia,11 de febrero de 1599
Capitán Urbaneja,cargo de,capitán
Gonzalo Gutiérrez,cargo de,comandante de partida española
Pelantaro,cargo de,jefe de indios de Purén
Francisco Hernández Ortiz,cargo de,comandante accidental de Angol
Fuerte de Molchén,ubicación de,dos leguas de Angol
Batalla por la ciudad de Angol,fecha de ocurrencia,20 de marzo
Anganamón,cargo de,cacique de la comarca de la Imperial
Anganamón,rol de,segundo de Pelantaro
Andrés Valiente,cargo de,corregidor de la Imperial
Andrés Valiente,lugar de trabajo,la Imperial
La Imperial,cantidad de jinetes disponibles,ciento cincuenta
La Imperial,cantidad de infantes disponibles,cuarenta y tres
Obispo fray Agustín Cisneros,fecha de muerte,dos años antes de 1598
Obispo fray Agustín Cisneros,cargo de,obispo
Combate en cercanías de la Imperial,fecha de ocurrencia,30 de enero de 1599
Pedro Olmos de Aguilera,cargo de,capitán
Pedro Olmos de Aguilera,rol de,vecino más considerado de la Imperial
Fortín de Maquegua,ubicación de,cercanías de la Imperial
Bernardino de Mendoza,destino de viaje,Concepción
Bernardino de Mendoza,fecha de nombramiento como emisario,27 de marzo
Río Cautín,ubicación de,ribera sur cerca de Boroa
Distrito de Boroa,distancia de la Imperial,poco más de dos leguas
Andrés Valiente,cantidad de soldados en expedición a Boroa,cuarenta
Batalla de Boroa,fecha de ocurrencia,8 de abril
Batalla de Boroa,cantidad de españoles sobrevivientes que llegaron a la Imperial,dos
Batalla de Boroa,cantidad de españoles sobrevivientes que llegaron a Villarrica,tres
Batalla de Boroa,cantidad de españoles muertos,treinta y cinco
Andrés Valiente,fecha de muerte,8 de abril
Jueves Santo de 1599,fecha de,8 de abril
Capitán Liñán de Vera,cargo de,capitán
Capitán Liñán de Vera,cantidad de hombres bajo su mando,veintidós
Río Toltén,ubicación de ataque,cercanías
Hernando Ortiz,cargo de,comandante de la Imperial tras muerte del corregidor
La Imperial,cantidad de defensores disponibles tras desastres,noventa
Baltasar de Villagrán,destino de viaje,Concepción
Fray Juan de Lagunilla,destino de viaje,Concepción
Baltasar de Villagrán,fecha de partida,9 de abril
Fray Juan de Lagunilla,fecha de partida,9 de abril
Diego Barros Arana,autor de,Purén indómito
Álvarez de Toledo,autor de relatos en,Purén indómito
Gregorio Serrano,autor de,relación inédita sobre combates
Fray Antonio de Riberos,cargo de,religioso
Fray Pedro de Angulo,cargo de,religioso
Fray Antonio de Riberos,fecha de exposición escrita,agosto de 1599
Fray Pedro de Angulo,fecha de exposición escrita,agosto de 1599
Exposición de religiosos,lugar de redacción,Valdivia
Francisco de Quiñones,cargo de,gobernador
Rodrigo de Bastidas,cargo de,capitán de Villarrica
Ciudad de Villarrica,ubicación geográfica,pie de la cordillera de los Andes
Ciudad de Santa Cruz,ubicación geográfica,faldas de la cordillera de la Costa
Francisco Jufré,cargo de,general de las operaciones militares
Francisco Jufré,subordinado de,gobernador interino Viscarra
Gobernador Viscarra,lugar de residencia,Concepción
Ciudad de Santa Cruz,distancia de,una legua del Biobío
Despoblación de Santa Cruz,fecha de ocurrencia,7 de marzo
Fuerte de Jesús,fundador,Óñez de Loyola
Fuerte de Jesús,ubicación de,sobre el río Biobío
Hernando de Andrade,cargo de,capitán del fuerte de Jesús
Alonso de Ribera,cargo de,gobernador
Juan Rodulfo Lisperguer,cargo de,capitán de Angol
Juan Rodulfo Lisperguer,lugar de nacimiento,Chile
Juan Rodulfo Lisperguer,origen paterno,caballero alemán
Padre del capitán Juan Rodulfo Lisperguer,lugar de establecimiento,Santiago
Indios rebeldes,fecha de ataque a Concepción,6 de abril
Luis de las Cuevas,cargo de,alférez real
Luis de las Cuevas,defensor de,ciudad de Concepción
