Sujeto,Relación,Objeto
Góngora Marmolejo,autor de referencia,capítulo 33
Francisco de Villagrán,cargo de,Gobernador de Chile
Alonso de Reinoso,cargo militar bajo mando de,Francisco de Villagrán
Pedro de Villagrán,relación familiar,hijo de Francisco de Villagrán
Francisco de Villagrán,cargo adicional de,teniente gobernador
Ciudad de Cañete,ubicación de operaciones militares de,Francisco de Villagrán
Fray Gil González Dávila,orden religiosa,dominicano
Fray Diego de Chávez,orden religiosa,dominicano
García Hurtado de Mendoza,cargo de,Gobernador de Chile
Fray Gil González Dávila,lugar de llegada a Chile,1557
Fray Diego de Chávez,lugar de llegada a Chile,1557
García Hurtado de Mendoza,año de llegada a Chile,1557
Fray Gil González Dávila,cargo religioso,prior del convento de Santiago
Don fray Tomás San Martín,cargo de,primer obispo de Charcas
Don fray Tomás San Martín,orden religiosa,dominicano
Juan Meléndez,lugar de nacimiento,Lima
Juan Meléndez,orden religiosa,dominicano
Juan Meléndez,autor de,Tesoros verdaderos de las Indias
Tesoros verdaderos de las Indias,año de publicación,1681-82
Tesoros verdaderos de las Indias,lugar de publicación,Roma
Tesoros verdaderos de las Indias,número de volúmenes,tres
Reginaldo de Lizárraga,nombre alternativo de,Baltasar de Obando
Reginaldo de Lizárraga,cargo de,tercer obispo de la Imperial
Reginaldo de Lizárraga,orden religiosa,dominicano
Fray Gil González Dávila,autor de,tratado sobre el trabajo personal de los indios
Tratado sobre el trabajo personal de los indios de Fray Gil González Dávila,año de escritura,1559
Felipe II,tipo de autoridad,Rey
Ciudad de Angol,tipo de entidad,ciudad del sur de Chile
Ciudad de la Imperial,tipo de entidad,ciudad del sur de Chile
Ciudad de Villarrica,tipo de entidad,ciudad del sur de Chile
Francisco de Villagrán,edad aproximada,cincuenta años
Francisco de Villagrán,estado de salud durante campaña,gravemente enfermo
Juan de Herrera,cargo de,teniente gobernador bajo Francisco de Villagrán
Juan de Herrera,profesión,licenciado
Pedro de Valdivia,tipo de conquistador,conquistador de Chile
Góngora Marmolejo,tipo de fuente,cronista
Juan Matienzo,cargo militar,capitán
Juan Matienzo,autor de carta fechada,1 de noviembre de 1573
Carta de Juan Matienzo,lugar de origen,Valdivia
Juan Jufré,cargo de,justicia mayor de Santiago
Juan Jufré,nombramiento recibido,27 de septiembre de 1561
Pedro de Villagrán,nombramiento como teniente gobernador de Santiago,22 de mayo de 1562
Pedro de Villagrán,número de soldados bajo su mando en Cañete,ciento veinte
Alonso de Reinoso,número de soldados bajo su mando en Cañete,ciento veinte
Ciudad de Concepción,tipo de entidad,ciudad de Chile
Ciudad de Santiago,tipo de entidad,ciudad de Chile
Gonzalo Pizarro,contexto histórico,guerras civiles del Perú
Zarzaparrilla,uso medicinal en,tratamiento de Francisco de Villagrán
Zarzaparrilla,origen de conocimiento terapéutico,indios de América tropical
Francisco de Villagrán,lugar de convalecencia invernal,la Imperial
Francisco de Villagrán,duración de convalecencia en Angol,dos meses
Convento dominicano de Santiago,año de fundación,1557
Convento dominicano de Santiago,número de religiosos iniciales,dos
Convento franciscano de Santiago,antigüedad respecto al dominicano,cuatro años antes
Licenciado Juan de Herrera,cargo de,juez teniente general de la provincia de Chile
Licenciado Juan de Herrera,acusador de,indios rebelados de Chile
Indios de Chile,acusados de,muertes y robos e insultos
Fray Gil de San Nicolás,defensor de,indios de Chile
Licenciado Juan de Herrera,sentencia dictada contra,indios de Chile
Licenciado Juan de Herrera,cantidad de hombres llevados a la guerra,doscientos hombres
Licenciado Juan de Herrera,destino de viaje,Lima
Licenciado Juan de Herrera,propósito del viaje a Lima,dar cuenta del estado de la guerra de Chile y pedir socorros
Memoriales del licenciado Herrera,lugar de conservación,Biblioteca Nacional de Madrid
Memoriales del licenciado Herrera,publicador,Pascual de Gayangos
Memoriales del licenciado Herrera,publicados como apéndice de,historia de Góngora Marmolejo
Historia de Góngora Marmolejo,publicada en,Colección de historiadores de Chile
Gaspar de Salazar,autor de,relación de las cosas que vio en la guerra de Chile
Relación de Gaspar de Salazar,período descrito,1561 hasta primeros días del gobierno de Bravo de Saravia
Relación de Gaspar de Salazar,lugar de conservación,Biblioteca Nacional de Madrid
Procedimiento del licenciado Herrera,aprobado por,teólogos más ilustrados de Lima
Bartolomé de Escobar,orden religiosa,jesuita
Bartolomé de Escobar,cargo de,revisor de la Crónica de Mariño de Lobera
Plaga de ranas,año de aparición,1556
Plaga de ranas,duración,quince días
Gobernador Villagrán,destino de viaje,Valdivia
Operaciones militares,comandantes dejados por Villagrán,capitanes de Cañete y Angol
Gobernador Villagrán,lugar de embarque,Valdivia
Gobernador Villagrán,cantidad de soldados embarcados,cuarenta soldados
Gobernador Villagrán,mes de embarque,mediados de octubre
Gobernador Villagrán,destino de navegación,Concepción
Buque de Villagrán,lugar de encallamiento,banco de arena en embocadura de río (probablemente el Pudeto)
Villagrán,lugar de arribo,Concepción en primeros días de diciembre de 1562
Pedro de Villagrán,relación con Gobernador Villagrán,hijo
Arias Pardo de Maldonado,relación con Gobernador Villagrán,yerno
Pedro de Villagrán,comandante de,fuerzas enviadas contra campo fortificado indígena
Arias Pardo de Maldonado,comandante de,fuerzas enviadas contra campo fortificado indígena
Combate del 8 de diciembre,fecha de ocurrencia,8 de diciembre de 1562
Capitán Pardo de Maldonado,padecimiento durante combate,ataque de parálisis
Capitán Pardo de Maldonado,lugar de transporte tras enfermedad,Concepción
Gobernador Villagrán,lugar de traslado,fuerte de Arauco
Licenciado Gutiérrez de Altamirano,cargo de,maestre de campo
Licenciado Gutiérrez de Altamirano,comandante de ataque contra,indios en sus posiciones
Pedro de Villagrán,orden recibida,reunirse al maestre de campo
Columna expedicionaria,número de soldados,noventa soldados
Columna expedicionaria,número de indios auxiliares,quinientos indios auxiliares
Columna expedicionaria,lugar de salida,Arauco
Cordillera de la Costa,nombre conocido en la época,Mareguano
Territorio de Catirai,ubicación,región oriental del lebu
Gobernador Villagrán,fecha de despacho firmado en Concepción,22 de diciembre de 1562
Pedro de Villagrán,cargo de,teniente gobernador de Santiago
Pedro de Villagrán,nombramiento como teniente gobernador,mayo de 1562
Juan Jufré,cargo previo,teniente gobernador de Santiago
Pedro de Villagrán,lugar de presencia en diciembre,Concepción en diciembre de 1562
Maestre de campo Altamirano,incidente durante batalla,cayó en foso
Pedro de Villagrán,posición en la batalla,vanguardia
Pedro de Villagrán,resultado en batalla,ultimado
Batalla de Mareguano,cantidad de bajas españolas,más de cuarenta españoles
Batalla de Mareguano,bajas incluidas,capitanes y soldados de gran reputación
Batalla de Mareguano,ruta de escape utilizada,camino de Concepción
Batalla de Mareguano,ruta de escape utilizada,camino de Angol
Batalla de Mareguano,ruta cerrada,camino de Arauco
Camino de Arauco,ubicación geográfica,cordillera de la Costa
Batalla de Mareguano,fecha estimada de ocurrencia,fines de enero o principios de febrero de 1563
Batalla de Mareguano,ubicación en,lebu de Mareguano
Lebu de Mareguano,parte geográfica de,cordillera de la Costa desde Arauco hasta el Biobío
Lebu de Catirai,ubicación en,faldas orientales de la cordillera de la Costa
Lebu de Catirai,extensión hasta,orillas del río Vergara
Fuerte donde fueron derrotados los españoles,ubicación en,quebrada de Lincoyán
Quebrada de Lincoyán,parte de,lebu de Catirai
Lorenzo Bernal de Mercado,cargo de,capitán de las huestes españolas
Lorenzo Bernal de Mercado,origen de viaje,Angol
Pedro de Villagrán,estado al momento de la derrota,muerto
Francisco de Villagrán,condición médica,dolores gotosos
Francisco de Villagrán,lugar de residencia durante los eventos,Arauco
Francisco de Villagrán,cargo de,Gobernador
Ciudad de Cañete,evento sufrido,despoblación
Francisco de Villagrán,decisión tomada,despoblación de la ciudad de Cañete
Ciudad de Cañete,destino de mujeres y niños,embarcados a Concepción
Ciudad de Cañete,destino final,arrasada hasta sus cimientos
Colocolo,cargo de,jefe de bandas indígenas
Colocolo,descripción,cacique de un valle vecino
Miguel de Avendaño y Velasco,cargo de,capitán defensor de Angol
Miguel de Avendaño y Velasco,característica,experiencia en guerra
Juana Quinel,identidad étnica,india yanacona
Juana Quinel,acción en combate,peleó con singular denuedo
Plaza de Angol,traslado de ubicación,dos leguas de distancia del sitio original
Plaza de Arauco,cantidad de defensores,ciento quince soldados españoles
Plaza de Arauco,equipamiento defensivo,artillería
Pedro de Villagrán,cargo de,capitán comandante en plaza de Arauco
Pedro de Villagrán,relación familiar con,primo del Gobernador Francisco de Villagrán
Lorenzo Bernal de Mercado,cargo de,capitán comandante en plaza de Arauco
Ejército indígena atacante de Arauco,cantidad estimada,veinte mil hombres
Lope Ruiz de Gamboa,cargo de,oficial distinguido
Lope Ruiz de Gamboa,estado en combate,muerto en batalla
Juan Enríquez,relación familiar con,hermano de Martín Ruiz de Gamboa
Juan Enríquez,relación familiar con,primo de Miguel de Velasco
Martín Ruiz de Gamboa,cargo futuro,gobernador de Chile
Miguel de Velasco,rol militar,defensor de Angol
Juan Enríquez,causa de muerte,ahogado por el humo
Sitio de Arauco,fecha de inicio del segundo asedio,26 de mayo
Colocolo,rol militar en sitio de Arauco,comandante de guerreros sitiadores
Lorenzo Bernal de Mercado,decisión tomada,expulsión de indios de servicio de la plaza
Francisco de Villagrán,lugar de residencia durante sitio de Arauco,Concepción
Martín de Peñaloza,ocupación,soldado de la conquista
Martín de Peñaloza,lugar de residencia inicial,La Imperial
Francisco Talaverano,colaborador de,Martín de Peñaloza
Juan de Matienzo,cargo de,capitán comandante de Valdivia
Francisco de Villagrán,cargo de,gobernador de Chile
Cristóbal de Molina,cargo de,vicario eclesiástico en Santiago
Cristóbal de Molina,edad aproximada,ochenta años
Gil González Dávila,ocupación,religioso dominicano
Juan Jufré,cargo de,teniente gobernador en Santiago
Cristóbal de Ravanera,cargo de,guardián franciscano
Alonso Ortiz,ocupación,licenciado
Francisco de Aguirre el mozo,relación familiar con,Francisco de Aguirre fundador de La Serena
Juan de Herrera,cargo de,teniente gobernador
García Hurtado de Mendoza,cargo previo de,gobernador de Chile
Gregorio de Castañeda,cargo de,capitán gobernador de Tucumán
Juan Pérez de Zurita,cargo previo de,gobernador de Tucumán
Ciudad de Nieva,ubicación en,valle de Jujuy
Ciudad de Nieva,fecha de fundación,20 de agosto de 1561
Góngora Marmolejo,autor de,crónica sobre sitio de Arauco
Marino de Lobera,autor de,crónica sobre sitio de Arauco
Felipe II,emisor de,cédula de encomienda de 11 de marzo de 1578
Juan Ruiz de León,destinatario de,cédula de encomienda de 11 de marzo de 1578
Gabriel de Villagrán,cargo de,general y justicia mayor de Chile
Pedro Olmos de Aguilera,ocupación,capitán
Antonia de Aguilera,destinataria de,título de encomienda de 28 de abril de 1615
Marqués de Montes Claros,cargo de,virrey del Perú
José Pérez García,autor de,Historia de Chile
Crescente Errázuriz,autor de,Los orígenes de la iglesia chilena
Ciudad de Córdoba en Tucumán,situación de,abandono por ataque indígena
Cañete,ubicación geográfica en,territorio de los calchaquíes
Londres,ubicación geográfica en,territorio de los calchaquíes
Capitán Peralta,cargo de,mando en Santiago del Estero
Francisco de Villagrán,cargo de,Gobernador de Chile
Bernardo de Huete,cargo de,maestre de embarcación
Isla de Leochengo,nombre español de,isla de Santa María
Pedro de Villagrán,parentesco de,primo de Francisco de Villagrán
Francisco de Villagrán,edad al morir,56 años
Francisco de Villagrán,lugar de nacimiento,Astorga
Francisco de Villagrán,padre de,Álvaro de Sarria
Francisco de Villagrán,madre de,doña Ana de Villagrán
Álvaro de Sarria,cargo de,comendador de la orden de San Juan
Francisco de Villagrán,fecha de fallecimiento,22 de junio de 1563
Francisco de Villagrán,lugar de sepultura,iglesia de San Francisco de Concepción
Francisco de Villagrán,esposa de,doña Cándida Montes
Francisco de Villagrán,hijo natural de,Álvaro de Villagrán
Álvaro de Villagrán,padre de,Francisco de Villagrán
Pedro de Villagrán,cargo de,Gobernador interino de Chile
Pedro de Villagrán,fecha de reconocimiento como gobernador,29 de junio de 1563
Juan de Herrera,cargo de,licenciado y teniente gobernador
Lorenzo Bernal de Mercado,cargo de,capitán de la plaza de Arauco
Plaza de Arauco,fecha de inicio de sitio,mediados de mayo de 1563
Plaza de Arauco,fecha de abandono del sitio,30 de junio de 1563
Pedro de Villagrán,cargo de,gobernador de Chile
Capitán Lorenzo Bernal de Mercado,comandante militar de la retirada de,plaza de Arauco
Plaza de Arauco,ubicación geográfica,territorio araucano
Cordillera de la Costa,característica geográfica,espesa y elevada en aquellas latitudes
Retirada de la plaza de Arauco,fecha de ocurrencia,julio de 1563
Pedro de Villagrán,lugar de residencia durante su estancia en,Perú
Pedro de Villagrán,cónyuge,doña Beatriz de Santillana
Doña Beatriz de Santillana,poseedora de,repartimiento de tierras y de indios en Perú
Doña Beatriz de Santillana,origen,española
Ciudad de Cañete,fecha de evacuación,primeros meses de 1563
Capitán Lorenzo Bernal de Mercado,comisionado para trasladarse a,Valdivia
Capitán Lorenzo Bernal de Mercado,comandante de,setenta hombres
Territorio entre los ríos de Biobío e Itata,situación,insurrección de indios
Capitán Francisco Vaca,comisionado para,asegurar la quietud durante las cosechas
Combate de Itata,fecha de ocurrencia,15 de enero de 1564
Caudillo Loble,líder militar de,cuerpo de indios en combate de Itata
Capitán Francisco Vaca,pérdida en combate de Itata,cuatro hombres muertos
Capitán Juan Pérez de Zurita,cargo anterior,gobernador de Tucumán
Capitán Juan Pérez de Zurita,comandante de,cuarenta soldados de Angol
Cacique Millalelmo,líder militar de,guerreros en vegas de Andalién
Combate de Andalién,fecha de ocurrencia,22 de enero de 1564
Combate de Andalién,ubicación,vegas de Andalién cerca de la nueva ciudad de Concepción
Don Pedro de Godoy,origen,caballero sevillano
Don Pedro de Godoy,muerto en,combate de Andalién
Capitán Juan Pérez de Zurita,llegada a orillas del,río Teno el 27 de enero de 1564
Derrota de Lautaro,fecha de ocurrencia,abril de 1557
Derrota de Lautaro,ubicación,orillas del Mataquito
Capitán Francisco Vaca,llegada a Santiago,25 de enero de 1564
Capitanes Diego de Carranza y Juan de Losada,llegada a Santiago,1 de febrero de 1564
Ciudad de Santiago,límite austral,río Maule
Cabildo de Santiago,fecha de reunión,1 de febrero de 1564
Cabildo Abierto de Santiago,fecha de reunión,2 de febrero de 1564
Fiesta de la purificación de la Virgen María,fecha de celebración,2 de febrero
Ciudad de Santiago,población de origen español,trescientos individuos incluyendo mujeres y niños
Ciudad de Santiago,sede de,obispado
Capitán Juan Pérez de Zurita,comandante de,ciento cincuenta hombres
Cacique Illangulién o Queupulién,líder militar de,indios que se preparaban para atacar Angol
Capitán Lorenzo Bernal de Mercado,cargo en,Angol
Combate cerca de Angol,fecha de ocurrencia,25 de marzo de 1564
Góngora Marmolejo,autor de,"capítulos 43, 44 y 45 de crónica"
Mariño de Lobera,autor de,libro 11 capítulos 22 y 23 de crónica
José Pérez García,autor de,historia manuscrita
Cacique Illangulién,lugar de muerte,batalla cerca de río Vergara
Ciudad de Angol,líder militar defensor,Capitán Bernal
Gobernador Pedro de Villagrán,lugar de sitio militar,Concepción
Ciudad de Concepción (1564),ubicación geográfica,bahía de Talcahuano
Ejército indígena que sitió Concepción,caudillos,Loble y Millalelmo
Gobernador Pedro de Villagrán,número de soldados en defensa de Concepción,doscientos hombres
Sitio de Concepción (1564),duración,sesenta días
Sitio de Concepción (1564),fecha de inicio,primeros días de febrero de 1564
Sitio de Concepción (1564),fecha de término,1 de abril de 1564
Martín Ruiz de Gamboa,relación familiar con,Rodrigo de Quiroga
Martín Ruiz de Gamboa,lugar de asilo,iglesia de San Francisco
Gobernador Pedro de Villagrán,maestre de campo en Concepción,Alonso de Reinoso
Capitán Bernal,número de auxiliares indígenas en batalla,quinientos auxiliares
Cabildo de Santiago,fecha de sesión presidida por Villagrán,3 de junio de 1564
Templo de frailes de la Merced en Concepción,evento sufrido,incendio por indios
Ciudad de Valdivia,relación administrativa con petición de,ciudad de La Imperial
Gabriel de Villagrán,cargo militar en,La Imperial
Martín Ruiz de Gamboa,destino de viaje planeado,España
Licenciado Juan de Herrera,cargo de,Gobernador
Licenciado Juan de Herrera,gasto en guerra de,treinta mil pesos de oro de la caja real
Capitán Juan Pérez de Zurita,comandante de,ciento cincuenta hombres
Pedro de Villagrán,cargo de,Gobernador
Capitán Pedro Hernández de Córdoba,comandante de,treinta soldados
Río Maule,ubicación de detención de,Pedro Hernández de Córdoba
Rodrigo de Quiroga,rival de,Pedro de Villagrán
Conde de Nieva,cargo de,Virrey del Perú
Licenciado Lope García de Castro,cargo de,Presidente del Perú
Licenciado Lope García de Castro,miembro de,Supremo Consejo de Indias
Capitán Juan Godínez,vecino de,Santiago
Capitán Juan Godínez,natural de,Ciudad de Úbeda en España
Pedro de Villagrán,fecha de partida de Santiago,mediados de enero de 1565
Pedro de Villagrán,comandante de,ciento cincuenta soldados españoles
Pedro de Villagrán,comandante de,ochocientos indios auxiliares
Capitán Martín Ruiz de Gamboa,comandante de,compañía de jinetes
Río Perquilauquén,ubicación de atrincheramiento de,indios
Pedro de Villagrán,fecha de llegada a Concepción,15 de abril de 1565
Región entre ríos Maule y Biobío,territorio pacificado por,Pedro de Villagrán
General Jerónimo Costilla,comandante de,doscientos hombres
General Jerónimo Costilla,encomendero de,ciudad del Cuzco
General Jerónimo Costilla,fecha de llegada a La Serena,tres meses después de principios de febrero de 1565
Conde de Nieva,confirmador del título de,Pedro de Villagrán
Santiago,ciudad contribuyente con,siete mil pesos de oro
Valdivia,ciudad contribuyente con,casi cuatro mil pesos de oro
Villarrica,ciudad contribuyente con,más de seis mil pesos de oro
Osorno,ciudad contribuyente con,casi cuatro mil pesos de oro
Jerónimo Costilla,destinatario de órdenes de,Villagrán
Jerónimo Costilla,lugar de desembarco,Valparaíso
Martín Ruiz de Gamboa,relación familiar con,Rodrigo de Quiroga
Martín Ruiz de Gamboa,cargo de,capitán
Poangue,tipo de lugar,pueblo de indios
Poangue,distancia de,diez leguas de Santiago
Jerónimo Costilla,lugar de situación el 17 de junio,orillas del Mapocho
Jerónimo Costilla,distancia de Santiago,tres leguas al poniente
Juan Álvarez de Luna,cargo de,capitán
Campofrío,cargo de,capitán
Carvajal,cargo de,capitán
Lorenzo Bernal de Mercado,cargo de,capitán
Jerónimo Costilla,fecha de entrada a Santiago,18 de junio
Rodrigo de Quiroga,cargo reconocido el 18 de junio de 1565,gobernador del reino de Chile
Pedro de Villagrán,lugar de prisión,Valparaíso
Pedro de Villagrán,duración de gobierno,dos años
Pedro de Villagrán,lugar de querella,Real Audiencia de Lima
Pedro de Villagrán,lugar de encomienda de su esposa,Cuzco
Pedro de Villagrán,edad cuando gobernó Chile,cincuenta años
Rodrigo González Marmolejo,cargo de,bachiller
Rodrigo González Marmolejo,cargo eclesiástico,cura vicario
Rodrigo González Marmolejo,cargo de,presbítero
obispado de Santiago,tipo de institución,diócesis
obispado de Santiago,relación de sufraganeidad con,arzobispado de Lima
obispado de Santiago,nombre completo,diócesis de Santiago de la Nueva Extremadura
Rodrigo González Marmolejo,cargo de primer obispo de,Santiago
Papa Pío IV,acto de erección de,diócesis de Santiago de la Nueva Extremadura
Papa Pío IV,fecha de erección del obispado,18 de mayo de 1561
Rey Felipe II,fecha de cédula sobre obispado,10 de febrero de 1562
iglesia catedral de Santiago,fecha de colocación de primera piedra,fines de 1560
don García Hurtado de Mendoza,acto de colocación de primera piedra de,iglesia catedral de Santiago
Juan de Herrera,cargo de,licenciado
Juan de Herrera,cargo de,teniente gobernador
Francisco Jiménez,cargo de,presbítero
Francisco Jiménez,representante de,obispo González Marmolejo
ceremonia de institución del obispado,fecha de,18 de julio de 1563
ceremonia de institución del obispado,lugar de,capilla de la iglesia mayor de Santiago
Rodrigo González Marmolejo,edad al fallecer,setenta y cuatro años
Rodrigo González Marmolejo,fecha de fallecimiento,últimos meses de 1564
Rodrigo González Marmolejo,años de residencia en Chile,veinticuatro años
Rodrigo de Quiroga,cargo de,general
Rodrigo de Quiroga,lugar de servicio previo,conquista del Perú
Pedro de Valdivia,año de columna en que se enroló Rodrigo de Quiroga,1540
Rodrigo de Quiroga,año de inicio de servicio en Chile,1540
Martín Ruiz de Gamboa,cargo de,general
isla de Chiloé,fundador de ciudad de Castro,general Ruiz de Gamboa
ciudad de Castro,ubicación,isla de Chiloé
Real Audiencia para Chile,función asignada,gobierno político y militar
Cañete,tipo de lugar,población
Analizando el fragmento proporcionado, procedo a extraer únicamente las tripletas RDF que estén **explícitamente** presentes en el texto, siguiendo los principios de predicados estáticos y entidades inequívocas.
Gaspar Orense,punto de embarque hacia,España
Gaspar Orense,punto de llegada,Nombre de Dios
Marina Ortiz de Gaete,relación conyugal con,Pedro de Valdivia
Marina Ortiz de Gaete,destino de viaje,Chile
Marina Ortiz de Gaete,punto de desembarque,Nombre de Dios
Cabildo de Santiago,fecha de reunión,12 de marzo de 1554
Juan de Cuevas,cargo en,Cabildo de Santiago
Juan de Cuevas,tipo de cargo,regidor
Francisco de Riberos,cargo en,Cabildo de Santiago
Francisco de Riberos,tipo de cargo,regidor
Francisco de Villagrán,cargo reclamado,Capitán General
Rodrigo de Quiroga,cargo de,gobernador provisorio
Cabildo de Santiago,fecha de asunción de mando,17 de marzo de 1554
Rodrigo de Quiroga,fecha de entrega de mando,17 de marzo de 1554
Francisco de Villagrán,fecha de conferencia con Cabildo,26 de marzo de 1554
Francisco de Aguirre,lugar de procedencia,Tucumán
Francisco de Aguirre,destino,La Serena
Francisco de Aguirre,cargo reclamado,Capitán General y Justicia Mayor
Francisco de Aguirre,fundamentación de cargo,testamento de Pedro de Valdivia
Francisco de Aguirre,fecha de partida hacia Tucumán,fines de 1552
Francisco de Aguirre,autor de mandato,Pedro de Valdivia
Núñez del Prado,cargo previo en,ciudad del Barco
ciudad del Barco,ubicación en,Tucumán
Francisco de Aguirre,número de soldados bajo mando,poco más de doscientos
Francisco de Aguirre,fecha de llegada a ciudad del Barco,primeros días de 1553
Francisco de Aguirre,cargo reconocido en,ciudad del Barco
Francisco de Aguirre,tipo de cargo en ciudad del Barco,Gobernador de la provincia
Santiago del Estero,fundador,Francisco de Aguirre
Santiago del Estero,fecha de fundación,diciembre de 1553
Santiago del Estero,ubicación geográfica,orillas del río Dulce
Santiago del Estero,función administrativa,cabecera de la provincia de Tucumán
Francisco de Aguirre,fecha de expedición de título,23 de marzo de 1554
Juan Gregorio de Bazán,cargo recibido,teniente en el gobierno de Tucumán
Juan Gregorio de Bazán,relación familiar con Francisco de Aguirre,primo hermano
Francisco de Aguirre,fecha de partida hacia La Serena,28 de marzo de 1554
Francisco de Aguirre,lugar de reconocimiento como Capitán General,La Serena
Cabildo de Santiago,fecha de reunión sobre Francisco de Aguirre,25 de mayo de 1554
Diego García de Cáceres,cargo en,Cabildo de Santiago
Diego García de Cáceres,tipo de cargo,miembro del Cabildo
Juan Godínez,cargo en,Cabildo de Santiago
Juan Godínez,tipo de cargo,miembro del Cabildo
Diego García de Cáceres,comisionado para tratar con,Francisco de Aguirre
Juan Godínez,comisionado para tratar con,Francisco de Aguirre
Pedro de Valdivia,creador de,provincia de Tucumán
provincia de Tucumán,extensión territorial,norte de Chile y regiones orientales hasta altura del río Choapa
Francisco Martínez Marina,autor de,Ensayo histórico-crítico sobre la legislación de los reinos de León y Castilla
Ensayo histórico-crítico sobre la legislación de los reinos de León y Castilla,lugar de publicación,Madrid
Ensayo histórico-crítico sobre la legislación de los reinos de León y Castilla,año de publicación,1808
ciudad de Concepción,situación administrativa,despoblada
ciudad de la Imperial,territorio en riesgo,atacada por indios
ciudad de Valdivia,territorio en riesgo,atacada por indios
Rodrigo de Quiroga,poseedor de,una de las fortunas más considerables de la colonia
Rodrigo de Quiroga,lugar de levantamiento de información,Santiago
Rodrigo de Quiroga,año de levantamiento de información,1560
Rodrigo de Quiroga,poseedor de,repartimientos de indios en Chile
García Hurtado de Mendoza,cargo de,Gobernador
Rodrigo de Quiroga,designado por el cabildo de Santiago el año,1554
Rodrigo de Quiroga,designación por García Hurtado de Mendoza el año,1560
Rodrigo de Quiroga,edad aproximada en 1565,más de cincuenta años
Jerónimo Costilla,procedencia de refuerzo,Perú
