Sujeto,Relación,Objeto
mineros de Malgamalga,receptores de envío de,cuatro soldados
Pedro de Valdivia,lugar de llegada a Chile,Valparaíso
Pedro de Valdivia,fecha de llegada a Valparaíso,mediados de abril de 1549
Pedro de Valdivia,cargo de,Gobernador de Chile
Jerónimo de Alderete,representante de,Pedro de Valdivia
Jerónimo de Alderete,fecha de juramento en nombre de Valdivia,19 de junio de 1549
Pedro de Valdivia,fecha de entrada solemne en Santiago,20 de junio de 1549
Pedro de Valdivia,fecha de juramento personal como Gobernador,20 de junio de 1549
Francisco de Villagrán,cargo de,teniente de capitán general de Chile
Francisco de Villagrán,fecha de partida desde Valparaíso,9 de julio de 1549
Francisco de Aguirre,encargado de,repoblación de La Serena
La Serena,fecha de fundación,26 de agosto de 1549
Santiago de Chile,categoría de,cabeza de la gobernación
La Serena,categoría de,ciudad
Juan Jufré,comandante de,cien hombres llegados por tierra desde el Perú
Pedro de Valdivia,cantidad de hombres traídos del Perú,doscientos hombres
Colonia de Chile,población española aproximada a fines de 1549,quinientos pobladores
Pedro de Valdivia,cantidad de oro entregado a Villagrán,treinta y seis mil castellanos
Juan Bautista Pastene,cargo de,capitán
Juan Bautista Pastene,cónyuge de,española natural de Canarias apellidada Ba
Vicencio del Monte,año de retorno a Chile,1549
Luis de Cartagena,cargo de,escribano
Luis de Cartagena,fecha de petición de sueldos atrasados,22 de marzo de 1550
Luis de Cartagena,número de hijos,tres hijos
Cabildo de Santiago,función de,otorgar cartas de vecindad
Pedro de Miranda,cargo de,procurador de ciudad en 1549
Pedro de Valdivia,destinatario de carta a,Carlos V
Francisco de Aguirre,cargo de alcalde de,Santiago
Juan Fernández Alderete,cargo de alcalde de,Santiago
Pedro de Valdivia,gobernador de,Chile colonial
La Gasca,otorgante de título de gobernador a,Pedro de Valdivia
Rodrigo de Quiroga,cargo de regidor perpetuo desde,1 de enero de 1550
Diego García de Cáceres,cargo de regidor perpetuo desde,1 de enero de 1550
Juan Gómez,cargo de regidor perpetuo desde,1 de enero de 1550
Lope de Landa,cargo de regidor perpetuo designado por,La Gasca
Yanaconas,origen geográfico,Perú
Yanaconas,función de,auxiliares en combates y trabajadores industriales
Negros esclavos,función de,menesteres domésticos y necesidades de guerra
Cabildo de Santiago,"función legislativa, judicial y administrativa de",colonia chilena
Pedro de Valdivia,año de nombramiento como gobernador,1541
Chácara o chacras,origen lingüístico,palabra de origen quechua
Cabildo,entidad concesionaria de,chacras
Pedro de Valdivia,ratificador de concesiones de chacras el,26 de julio de 1549
Alarife,función de,director de obras públicas y trazado de canales
Francisco de Alvarado,introductor de ganado vacuno en,Chile en 1510
Francisco de Alvarado,cantidad de ganado introducido,diez vacas y diez toros
Santiago,número de molinos en 1553,cuatro establecimientos
Santiago,año de establecimiento de primera carnicería,1567
Carnicería de Santiago,frecuencia de venta de carne fresca,dos veces por semana
Pie de olivo,año de introducción en Chile,1561
Vid,año de cultivo para fabricación de vino en Chile,1555
Primer molino de Santiago,ubicación de,falda del cerro de Santa Lucía
Alonso González de Nájera,cargo de,maestre de campo
Alonso González de Nájera,autor de,Desengaño de la guerra de Chile
Chile,ubicación geográfica de,selvas
Santiago,lugar de ubicación,riberas del río Maipo
río Maipo,extensión geográfica desde,sierra hasta el mar
Pedro de Valdivia,autoridad otorgante a,ciudad de Santiago
ciudad de Santiago,propiedad de,bosques de las riberas del río Maipo
Garcilaso de la Vega,autor de,Primera parte de los comentarios reales del Perú
Antonio de Rivera,lugar de procedencia,Sevilla
Antonio de Rivera,lugar de plantación de olivos,alrededores de Lima
Chile,lugar de propagación de,olivo
Santiago,lugar de sesión del,Cabildo
río Maipo,lugar de construcción de,puente
río Cachapoal,lugar de construcción de,puente
Santiago,lugar de residencia de,herreros
Santiago,lugar de residencia de,zapateros
Santiago,lugar de residencia de,sastres
Santiago,lugar de residencia de,carpinteros
Cabildo,creador de,aranceles
procurador de ciudad,cargo solicitante ante,Cabildo
escribano de Cabildo,cargo firmante de,arancel
Zamora,ocupación de,herrero
Zamora,lugar de residencia,Santiago
Malgamalgaz,ubicación de,lavaderos de oro
Pedro de Valdivia,destino de expedición,provincias del sur
Perú,lugar de procedencia de,comerciantes
Perú,lugar de procedencia de,mercaderías
Chile,lugar de destino de,mercaderías del Perú
Campomanes,autor de,Discurso sobre educación popular
- Institucos/establecimientos: tiánguez (mercado público), fundición real, iglesia
Irigo González Marmolejo,cargo de,primer curato de Santiago
Irigo González Marmolejo,designador,obispo del Cuzco
Cabildo de Santiago,asignación salarial a,Irigo González Marmolejo
Francisco Muñoz,cargo de,procurador de ciudad de Santiago
tiánguez,ubicación,plaza pública de Santiago
iglesia,ubicación,plaza de Santiago
Valdivia,cargo de,Gobernador
Andrés de Pereda,cargo de,ensayador de Santiago
Pedro González,cargo de,ensayador de Santiago
Pedro González,ocupación,soldado platero
Valdivia,designador de cargo a,Pedro González
Alonso de Ribera,cargo de,gobernador de Chile
Luis de la Fuente,cargo de,doctor
fundición real de Santiago,establecedor,Valdivia
quintos reales,porcentaje de impuesto,veinte por ciento
tesorero,rol en,fundición real
contador,rol en,fundición real
veedor de la real hacienda,rol en,fundición real
fundición real,ubicación en,La Serena
fundición real,ubicación en,Valdivia
Francisco de Aguirre,autorizador de fundición en,La Serena
Chile,año de circulación de moneda,1601
Pedro de Villagrán,cargo de,procurador del cabildo de Santiago
carta de Pedro de Villagrán,destinatario,La Gasca
carta de Pedro de Villagrán,fecha,15 de noviembre de 1548
carta de Pedro de Villagrán,lugar de presentación,Lima
peso de oro,equivalencia,un castellano de oro
tomín,equivalencia,octava parte del peso de oro
real de oro,equivalencia,octava parte del peso de oro
ducado,equivalencia,seis tomines
ducado,equivalencia,seis reales de oro
oro marcado,lugar de marcado,fundición real
tejos de oro,lugar de fabricación,fundición real
Cabildo de Santiago,fecha de entrada en posesión de Irigo González Marmolejo,diciembre de 1547
tiánguez de Santiago,fecha de establecimiento,julio de 1552
Cabildo de Santiago,fecha de aprobación del tiánguez por Valdivia,noviembre de 1552
Cabildo de Santiago,fecha de bando sobre tiánguez,19 de diciembre de 1552
Cabildo de Santiago,fecha de ordenanza sobre envío de indios al mercado,2 de enero de 1556
Valdivia,año de regreso del Perú,1549
fundición real de Santiago,año de instalación,1549
Cabildo de Santiago,fecha de ordenanza sobre oro en polvo,13 de noviembre de 1550
Cabildo de Santiago,fecha de ordenanza sobre comercio de oro,5 de agosto de 1552
Francisco de Aguirre,fecha de autorización para fundición,octubre de 1552
Cabildo de Santiago,fecha de entrega de marca al fundidor,octubre de 1552
Valdivia,fecha de nombramiento de Pedro González,junio de 1553
Cabildo de Santiago,fecha de ordenanza sobre pequeñas transacciones,24 de enero de 1553
Cabildo de Santiago,fecha de ordenanza sobre fundición,julio de 1553
carta de Luis de la Fuente al Rey,fecha,4 de abril de 1623
carta de Luis de la Fuente al Rey,lugar de escritura,Lima
oficiales reales de Santiago,fecha de carta al Rey,diciembre de 1547
quintos reales,monto recogido hasta 1547,40000 pesos de oro
camisa,precio en Chile,20 pesos de oro
borceguíes,precio en Chile,20 pesos de oro
arroba de vino,precio en Chile,20 pesos de oro
tiánguez,palabra de origen,tianguistli mexicano
Cabildo de Santiago,promulgador de ordenanzas de minería,1552-1553
minas de plata del Alto Perú,ubicación,provincia de Charcas
Diego Barros Arana,autor de,Historia jeneral de Chile
Diego Barros Arana,autor de,Obras completas
Obras completas de Diego Barros Arana,número de volúmenes,dieciséis volúmenes
Alberto Edwards Vives,labor,historiográfica heterogénea
Francisco Antonio Encina,labor,historiográfica heterogénea
Jaime Eyzaguirre,labor,historiográfica heterogénea
Andrés Bello,intelectual de,Chile
Diego Barros Arana,intelectual de,Chile
Alonso de Ovalle,orden religiosa,jesuita
Alonso de Ovalle,época de escritura,primera mitad del siglo XVII
Juan Ignacio Molina,nacionalidad,chileno
Juan Ignacio Molina,título religioso,abate
Juan Ignacio Molina,autor de,Compendio de la historia civil del reino de Chile
Compendio de la historia civil del reino de Chile,idioma original,italiano
Compendio de la historia civil del reino de Chile,lugar de publicación,Bolonia
Compendio de la historia civil del reino de Chile,año de publicación,1787
Compendio de la historia civil del reino de Chile,formato de publicación,un volumen en 8°
Claudio Gay,autor de,Historia política de Chile
Historia política de Chile,número de volúmenes,ocho volúmenes en 8°
Claudio Gay,ocupación,naturalista
Claudio Gay,autor de,Historia física y política de Chile
Archivo de Indias,ubicación,Sevilla
Diego Barros Arana,edad al concluir Historia jeneral,setenta y dos años
lavaderos de oro,productor de,cantidad limitada de beneficio
terrenos auríferos,ubicación de,provincias reconquistadas por los araucanos
Cabildo,fecha de sesión,5 de agosto de 1550
Cabildo,fecha de sesión,9 de agosto de 1550
padre jesuita Diego de Rosales,autor de,Historia jeneral del reino de Chile
Historia jeneral del reino de Chile,división estructural,"lib. 11, cap. 8"
padre Rosales,período de escritura,segunda mitad del siglo XVII
premio por descubrimiento de vetas de plata,monto de,cinco mil pesos de oro
premio por descubrimiento de vetas de plata,jurisdicción de otorgamiento,ciudad de Santiago
Pedro de Villagrin,cargo de,cumplidor de dedo de Santiago
Pedro de Villagrin,destinatario de petición a,"La Gasca, gobernador del Perú"
petición de Pedro de Villagrin,fecha de,1548
procurador del cabildo de Santiago,solicitante de,reducción a la mitad del impuesto del oro
impuesto del oro de lavaderos,fuente de renta para,la Corona
ganadería y agricultura,contribución aplicada,diezmo
Cabildo,fecha de acuerdo,1 de marzo de 1553
jurisdicción de Santiago,extensión norte-sur,del río Choapa al río Maule
jurisdicción de Santiago,ancho de,cien leguas desde el mar
jurisdicción de Santiago,extensión oriental,lado oriental de cordillera de los Andes
Cabildo,fecha de sesión,13 de noviembre de 1552
obispo electo González Marmolejo,autor de,nota de 1558
diezmos de Chile del Maule al norte,período de producción,desde 1546 hasta 1558
diezmos de Chile del Maule al norte,suma producida en período 1546-1558,54.618 pesos
diezmos de Chile del Maule al norte,producción en año 1546,600 pesos
administración de justicia,funcionarios a cargo,alcaldes municipales
alcaldes municipales,período de renovación,cada año
causas de mayor importancia y apelaciones,funcionario resolutor,Gobernador
Valdivia,delegación de facultades judiciales en,teniente gobernador
capitanes Alonso de Monroy,cargo ejercido,teniente gobernador
capitán Francisco de Villagrán,cargo ejercido,teniente gobernador
licenciado Antonio de Peñas,acompañante de Valdivia en llegada a,Perú en 1549
licenciado Antonio de Peñas,título otorgado por Valdivia,juez superior de la colonia
nombramiento de Antonio de Peñas,fecha de,18 de julio de 1549
cédula real sobre apelaciones,fecha de,9 de abril de 1554
cédula real sobre apelaciones,autoridad emisora,el Rey
cabildos de Chile,facultad otorgada por cédula de 9 de abril de 1554,entender en apelaciones que no pasen de 300 pesos de oro
licenciado De las Peñas,fecha de negativa a asistir a sesión del Cabildo,23 de septiembre
Valdivia,ubicación durante revocación de nombramiento de De las Peñas,Concepción
Valdivia,fecha de revocación de nombramiento del licenciado De las Peñas,7 de abril de 1550
general Jerónimo de Alderete,título otorgado por Valdivia,juez de comisión
general Jerónimo de Alderete,cargo asumido,juez superior
Rodrigo de Quiroga,cargo designado por Alderete,teniente de gobernador
Valdivia,funcionario nombrado para administrar justicia en lavaderos de oro Malgamala,alcalde
Cabildo,fecha de sesión,25 de septiembre
licenciado De las Peñas,participante en sesión de Cabildo de,25 de septiembre
ministros del tesoro,nombre alternativo,oficiales reales
ministros del tesoro,facultad en Ayuntamiento según decisión de La Gasca,voz y voto
Cabildo,fecha de reunión en iglesia mayor de Santiago,2 de octubre
Cabildo,frecuencia de sesiones acordada el 2 de octubre,"tres días en la semana: lunes, miércoles y viernes"
bachiller Rodrigo González,cargo de,vicario general
Mateo Díaz,nombramiento para cargo de,alcalde de minas
nombramiento de Mateo Díaz como alcalde de minas,fecha de,2 de enero de 1550
Cabildo,fecha de sesión,29 de enero de 1551
Valdivia,obligación de,hacer a sus expensas todos los gastos de operaciones militares de la conquista
Valdivia,terreno reservado en distribución de solares,costado norte de la plaza con una cuadra de fondo
casas de Valdivia,material de techado,paja
Valdivia,año de venta de casas de su propiedad,1552
casas vendidas por Valdivia,forma de pago,producto de multas o fondos de la caja real
casas vendidas por Valdivia,instalaciones establecidas,"Cabildo, fundición real, oficinas de tesoreros, primera cárcel pública"
Cabildo,fecha de reconocimiento de riesgo de fuego,4 de marzo de 1552
edificios de las casas del rey,material de cubierta,paja
casas vendidas por Valdivia,nombre posterior,las casas del rey
rollo,ubicación de,"centro de la plaza, frente a las casas del rey"
rollo,descripción física,columna de piedra
rollo,función en ciudades españolas,signo de jurisdicción
rollo,uso punitivo,fijación de cabeza de criminales ejecutados y aplicación de pena de azotes
Presidente La Gasca,emisor de resolución sobre,Pedro de Valdivia
Pedro de Valdivia,obligado a devolver fondos a,caja y hacienda de S.M.
Cabildo de Santiago,fecha de sesión,4 de marzo de 1552
Cabildo de Santiago,fecha de sesión,13 de noviembre de 1552
primeros muebles del Cabildo,fecha de construcción,abril de 1552
Santiago de Chile,denominación de capital de,reino de la Nueva Extremadura
Cabildo de Santiago,fecha de ordenanza de limpieza,1550
Pedro de Valdivia,destino de marcha,sur de Chile
Nueva Extremadura,tipo de entidad política,reino
Cabildo de Santiago,fecha de ordenanza de queda,5 de noviembre
Cabildo de Santiago,fecha de ordenanza de seguridad nocturna,23 de diciembre de 1549
Cabildo de Santiago,fecha de ordenanza sobre queda,31 de julio de 1551
ordenanza general de policía,fecha de aprobación,30 de marzo de 1569
ordenanza general de policía,entidad aprobadora,audiencia de Lima
ordenanza general de policía,ubicación de publicación,primer tomo de Documentos publicados por don Claudio Gay
Cabildo de Santiago,fecha de admisión de licenciado en medicina,1552
Cabildo de Santiago,fecha de sesión con tres abogados,1556
Santiago de Chile,cantidad de abogados en,tres en 1556
sistema de repartimientos,fecha de sanción,1546
Capitán Juan Jufré,rol de,juez especial de repartimientos
Capitán Juan Jufré,comisionado por,Cabildo de Santiago
Pedro de Valdivia,emisor de ordenanza sobre pleitos de indios,Concepción
ordenanza de Valdivia sobre pleitos de indios,fecha de emisión,7 de abril de 1553
Pedro de Valdivia,opinión sobre,indios de Chile
ordenanza sobre taquis,fecha de emisión,1551
palabra taqui,idioma de origen,quechua
taqui,significado en quechua,música o reunión en que se canta y se baila
palabra taqui,región de uso,parte de Chile sometida a los incas
tambos,definición de,posadas para descanso de viajeros
Pedro de Valdivia,emisor de disposición sobre carga de indios,caminos de Chile
límite de carga para indios,cantidad establecida por Valdivia,dos arrobas
procurador de ciudad,fecha de solicitud sobre hechiceros,enero de 1552
hechiceros indígenas,denominación indígena,ambicamayos
Pedro de Valdivia,lugar de emisión de ordenanza,Concepción
Pedro de Valdivia,fecha de emisión de ordenanza,4 de octubre de 1551
Pedro de Valdivia,lugar de residencia durante sesión de cabildo,Santiago
Ambicamayo (ambicamayu),término equivalente a,hechicero
Ambicamayo (ambicamayu),origen geográfico del término,Perú
Hamppicamayu,componente etimológico,hamppi (medicina)
Hamppicamayu,componente etimológico,"veneno, hechizo"
Hamppicamayu,componente etimológico,camayu (el que tiene poder)
Hechiceros chilenos,denominación indígena,huecuvutuvoe
Hechiceros chilenos,denominación indígena,machituvoe
Pedro de Valdivia,cargo de,Gobernador
Cargo de juez pesquisidor de hechiceros indígenas,fecha de creación,1552
Iglesia mayor de Santiago,ubicación,costado occidental de la plaza mayor
Iglesia mayor de Santiago,fundador,Pedro de Valdivia
Iglesia mayor de Santiago,tiempo de construcción,más de diez años
Ermita de Santa Lucía,ubicación,cerro Santa Lucía (Huelén)
Ermita de Santa Lucía,fundador,Juan Fernández de Alderete
Ermita de Monserrate,ubicación,norte de la ciudad de Santiago
Ermita de Monserrate,fundadora,Inés Suárez
Ermita de Monserrate,benefactor de dotación de tierras,Pedro de Valdivia
Inés Suárez,relación con,Pedro de Valdivia
Ermita de la Virgen del Socorro,tipo de edificación,ermita
Pedro de Valdivia,fecha de declaración en Lima,1548
Pedro de Valdivia,autoridad ante quien se defendió,presidente La Gasca
Pedro de Valdivia,número de templos fundados según su declaración,cinco o seis templos
Clero de Chile en primeros días de la Conquista,número de miembros,tres individuos
Iglesia de Santiago,rango eclesiástico,parroquia
Iglesia de Santiago,fecha de elevación a parroquia,1547
Iglesia de Santiago,dependencia eclesiástica,obispado del Cuzco
Hernando Ortiz de Zúñiga,cargo eclesiástico,visitador eclesiástico
Hernando Ortiz de Zúñiga,autoridad que lo envió,obispo diocesano
Hernando Ortiz de Zúñiga,fecha de petición al Cabildo,13 de noviembre de 1552
Religiosos franciscanos,fecha de obtención de terreno,octubre de 1553
Religiosos franciscanos,tipo de bien obtenido,terreno para iglesia
Gonzalo Yáñez (González Yíñez),origen geográfico,portugués
Gonzalo Yáñez (González Yíñez),cargo eclesiástico propuesto,cura
Gonzalo Yáñez (González Yíñez),relación con Pedro de Valdivia,amigo particular
Nuño de Abrego,cargo eclesiástico,cura
Nuño de Abrego,lugar de muerte,Concepción
Cerro Huelén,nombre colonial,Santa Lucía
Juan Fernández Alderete,donante de terrenos a,fray Martín de Robledo
fray Martín de Robledo,cargo religioso de,comisario de la orden de San Francisco
Juan Fernández Alderete,donante de,ermita del cerro Santa Lucía
terrenos al pie del cerro Santa Lucía,donante,Juan Fernández Alderete
ermita del cerro Santa Lucía,ubicación,cerro Santa Lucía
Cabildo de Santiago,función de,sancionó donación de Juan Fernández Alderete
convento de San Francisco,ubicación diferente de,terrenos donados al pie del cerro Santa Lucía
iglesia de San Francisco,ubicación diferente de,terrenos donados al pie del cerro Santa Lucía
padre Olivares,autor de,Historia civil de Chile
franciscanos,orden religiosa establecida en Chile en,1553
dominicanos,orden religiosa establecida en Chile en,1557
dominicanos,años después del establecimiento que,franciscanos
Pedro de Valdivia,cargo de,Gobernador de Chile
Santiago,ciudad objeto de,defensa militar
Pedro de Valdivia,lugar de regreso desde,Perú
La Serena,evento sufrido,destrucción por insurrección de indios
Francisco de Aguirre,misión de,repoblar La Serena
capitán Jufré,origen de llegada,Perú
Pedro de Valdivia,fecha de revista militar,8 de septiembre de 1549
Pedro de Valdivia,lesión sufrida,fractura de dedos del pie derecho
Pedro de Valdivia,período de reposo,tres meses en cama
Cabildo de Santiago,fecha de reunión con Valdivia,13 de octubre
procurador de ciudad,petición a Valdivia sobre,defensa de Santiago
río Itata,límite geográfico mencionado para,transporte de indios auxiliares
Pedro de Valdivia,fecha de testamento,23 de diciembre de 1549
Pedro de Valdivia,testigos del testamento,siete testigos
arca de tres llaves del tesoro real,contenido custodiado,testamento de Pedro de Valdivia
licenciado Antonio de las Peñas,cargo de,justicia mayor de Santiago
Rodrigo de Quiroga,cargo de,teniente gobernador
Rodrigo de Quiroga,fecha de reconocimiento como teniente gobernador,mayo de 1550
río Biobío,ubicación de,batalla nocturna de Andalién
Concepción,fundador,Pedro de Valdivia
ciudad de la Imperial,ubicación de fundación,márgenes del Cautín
Francisco de Villagrán,misión,incorporar ciudad del Barco a gobernación de Valdivia
Francisco de Villagrán,número de soldados traídos a Chile,doscientos soldados
ciudad de Valdivia,fundador,conquistadores españoles
ciudad de Villarrica,fundador,conquistadores españoles
provincias de Arauco,objetivo militar de,Pedro de Valdivia
arcabuces,tipo de arma de,infantería española
arcabuces,método de disparo,mecha o cuerda encendida
cañutos de hojalata,contenido,pólvora para un tiro
cañones,año de uso en Chile,1554
cañones,característica,pequeño calibre
Tropas conquistadoras del siglo XVI,armamento principal,caballos y armas blancas
Soldados de Pedro de Valdivia,tipo de armadura,armaduras modestas de acero
Infantes conquistadores,armadura defensiva,coraza simple que protege pecho y espalda
Jinetes conquistadores,armadura defensiva,armaduras completas de acero de pies a cabeza
Soldados conquistadores,arma defensiva portátil,adargas o escudos de cuero en brazo izquierdo
Soldados conquistadores,protección de cabeza,cascos celadas de metal con carrilleras
Cascos celadas,revestimiento interior,cojincillo o acolchado de algodón
Pica o lanza,material de construcción,vara sólida de madera de fresno
Pica o lanza,longitud,poco menos de tres metros
Pica o lanza,extremidad,punta de acero de tres o cuatro filos
Clérigo en guerras civiles del Perú,innovación táctica,amarrar picas con correas a silla y pecho del caballo
Soldados conquistadores (infantes y jinetes),arma blanca personal,espada
Jinetes conquistadores,armas adicionales,hachas de combate y clavas o mazas de fierro
Pedro de Valdivia,fecha de partida de Santiago,primeros días de enero de 1550
Columna expedicionaria de Valdivia,composición numérica,poco más de doscientos hombres
Pedro de Valdivia,condición en partida,convaleciente de fractura de pie
Pedro de Valdivia,medio de transporte inicial,litera cargada por indios auxiliares
Jerónimo de Alderete,rango militar en expedición,teniente general de las armas
Pedro de Villagrín,rango militar en expedición,maestre de campo o jefe de estado mayor
Pedro de Valdivia,presencia en Santiago el 2 de enero,firma nombramiento de Mateo Díaz como alcalde de minas de Malgamalga
Mateo Díaz,cargo designado,alcalde de las minas o lavaderos de Malgamalga
Requerimiento de paz,autor,doctor Palacios Rubios
Requerimiento de paz,contenido,intimación de sometimiento a rey de España por dominio papal sobre América
Río Nivequetén,nombre actual,río de la Laja
Río Nivequetén (Laja),característica del vado,agua llegaba a estribos de los caballos
Cuerpo de indios en río Nivequetén,número estimado por Valdivia,dos mil hombres
Pedro de Villagrín,acción en río Nivequetén,desbarató indios con la vanguardia
Españoles,fecha de llegada a orillas del Biobío,24 de enero
Jerónimo de Alderete,protagonismo en batalla,honor de la jornada en combate tras dos leguas
Españoles en batalla del Biobío,pérdida humana,un solo hombre arrastrado por corriente del río
Pedro de Valdivia,exploración con jinetes,cincuenta jinetes durante dos días hacia el mar
Valle de Andalién,ubicación de campamento español,terreno llano y bajo entre río Andalién y río Biobío
Campamento de Andalién,proximidad geográfica,cerca de lagunas de agua dulce
Batalla de Andalién,fecha,noche del 22 de febrero
Ejército indígena en Andalién,estimación numérica por Valdivia,veinte mil hombres
Batalla de Andalién,duración,tres horas
Pedro de Valdivia,experiencia militar declarada,30 años peleando contra muchas naciones
Mariño de Lobera,participación en batalla,asistió a batalla de Andalién
Mariño de Lobera,fecha alternativa de batalla,24 de febrero
Batalla de Andalién,bajas españolas mortales,un solo muerto por tiro de arcabuz de camarada
Batalla de Andalién,heridos españoles,sesenta caballos y sesenta cristianos
Góngora Marmolejo,testimonio sobre heridos,ningún español quedó sin heridas
Lagunas de Andalién,estado actual,no existen en el día
Sitio de batalla de Andalién,ubicación actual,sitio donde se asienta Concepción
Pedro de Valdivia,fecha de traslado a costa,23 de febrero
Nuevo campamento de Valdivia,ubicación,orilla del mar en bahía de Talcahuano
Pedro de Valdivia,explorador de bahía,vio bahía en 1546
Pedro Gómez,cargo durante campaña,alcalde del cabildo de Santiago
Pedro Gómez,participación en campaña,no salió de Santiago
Padre Rosales,error cronológico,sitúa campaña en año 1549
Penco,nombre indígena de,lugar de fundación de Concepción
Pegnco,nombre indígena alternativo de,lugar de fundación de Concepción
Penco,ubicación de,orillas del mar
Valdivia,explorador de,Penco en campaña de 1546
Concepción,fecha de fundación,3 de marzo de 1550
Concepción,fundador,Valdivia
Batalla de Penco,fecha de ocurrencia,12 de marzo de 1550
Jerónimo de Alderete,rol militar de,líder de carga con cincuenta caballeros en batalla de Penco
Francisco de Riberos,cargo militar de,capitán
Juan Godínez,cargo político de,regidor del cabildo de Santiago en 1550
Gregorio de Castañeda,cargo militar de,capitán
